{
  "$schema": "https://json-schema.org/draft/2020-12/schema",
  "$id": "triage-input.schema.json",
  "title": "Exposure Triage Input Bundle Schema",
  "type": "object",
  "additionalProperties": false,
  "required": [
    "schema_version",
    "bundle_id",
    "created_at",
    "advisories",
    "assets",
    "components",
    "reachability"
  ],
  "properties": {
    "schema_version": {
      "const": "cops.exposure-triage-input/v1"
    },
    "bundle_id": {
      "type": "string",
      "minLength": 1
    },
    "created_at": {
      "type": "string"
    },
    "advisories": {
      "type": "array",
      "items": {
        "$ref": "#/$defs/advisory"
      }
    },
    "assets": {
      "type": "array",
      "items": {
        "$ref": "#/$defs/asset"
      }
    },
    "components": {
      "type": "array",
      "items": {
        "$ref": "#/$defs/component"
      }
    },
    "reachability": {
      "type": "array",
      "items": {
        "$ref": "#/$defs/reachability_record"
      }
    }
  },
  "$defs": {
    "advisory": {
      "type": "object",
      "additionalProperties": false,
      "required": [
        "advisory_id",
        "component_name",
        "vulnerable_version_spec",
        "cvss_score",
        "cve_summary",
        "known_exploited_in_wild"
      ],
      "properties": {
        "advisory_id": {
          "type": "string"
        },
        "component_name": {
          "type": "string"
        },
        "vulnerable_version_spec": {
          "type": "string"
        },
        "cvss_score": {
          "type": "number",
          "minimum": 0.0,
          "maximum": 10.0
        },
        "cve_summary": {
          "type": "string"
        },
        "known_exploited_in_wild": {
          "type": "boolean"
        },
        "remediation_guidance": {
          "type": "string"
        }
      }
    },
    "asset": {
      "type": "object",
      "additionalProperties": false,
      "required": [
        "asset_id",
        "display_name",
        "subscription_id",
        "resource_type",
        "owner",
        "criticality",
        "is_internet_exposed",
        "inventory_timestamp"
      ],
      "properties": {
        "asset_id": {
          "type": "string"
        },
        "display_name": {
          "type": "string"
        },
        "subscription_id": {
          "type": "string"
        },
        "resource_type": {
          "type": "string"
        },
        "owner": {
          "type": "string"
        },
        "criticality": {
          "enum": ["crown_jewel", "high", "medium", "low"]
        },
        "is_internet_exposed": {
          "type": "boolean"
        },
        "inventory_timestamp": {
          "type": "string"
        },
        "tags": {
          "type": "object"
        }
      }
    },
    "component": {
      "type": "object",
      "additionalProperties": false,
      "required": [
        "component_id",
        "asset_id",
        "component_name",
        "installed_version",
        "dependency_type"
      ],
      "properties": {
        "component_id": {
          "type": "string"
        },
        "asset_id": {
          "type": "string"
        },
        "component_name": {
          "type": "string"
        },
        "installed_version": {
          "type": "string"
        },
        "dependency_type": {
          "enum": ["direct", "transitive", "unknown"]
        },
        "file_path": {
          "type": "string"
        },
        "sha256": {
          "type": "string"
        }
      }
    },
    "reachability_record": {
      "type": "object",
      "additionalProperties": false,
      "required": [
        "reachability_id",
        "asset_id",
        "route_type",
        "source_evidence",
        "confidence"
      ],
      "properties": {
        "reachability_id": {
          "type": "string"
        },
        "asset_id": {
          "type": "string"
        },
        "route_type": {
          "enum": [
            "public_internet",
            "internal_lateral",
            "isolated",
            "airgapped",
            "contradictory"
          ]
        },
        "source_evidence": {
          "type": "string"
        },
        "port_or_protocol": {
          "type": "string"
        },
        "is_blocked_by_control": {
          "type": "boolean"
        },
        "confidence": {
          "enum": ["confirmed", "inferred", "contradictory", "unknown"]
        },
        "notes": {
          "type": "string"
        }
      }
    }
  }
}
