{
  "schema_version": "cops.exposure-triage-input/v1",
  "bundle_id": "bundle-contoso-enterprise-01",
  "created_at": "2026-09-30T12:00:00Z",
  "advisories": [
    {
      "advisory_id": "CVE-2021-44228",
      "component_name": "org.apache.logging.log4j:log4j-core",
      "vulnerable_version_spec": ">=2.0, <=2.14.1",
      "cvss_score": 10.0,
      "cve_summary": "Remote Code Execution via JNDI lookup vulnerability in Log4j2.",
      "known_exploited_in_wild": true,
      "remediation_guidance": "Upgrade to log4j-core 2.17.1 or higher."
    },
    {
      "advisory_id": "CVE-2023-4863",
      "component_name": "libwebp",
      "vulnerable_version_spec": "<1.3.2",
      "cvss_score": 8.8,
      "cve_summary": "Heap buffer overflow in WebP lossless encoding.",
      "known_exploited_in_wild": true,
      "remediation_guidance": "Upgrade libwebp to 1.3.2 or later."
    },
    {
      "advisory_id": "CVE-2024-21626",
      "component_name": "runc",
      "vulnerable_version_spec": "<1.1.12",
      "cvss_score": 8.6,
      "cve_summary": "Container breakout via leaked file descriptors.",
      "known_exploited_in_wild": false,
      "remediation_guidance": "Upgrade runc to 1.1.12 or higher."
    }
  ],
  "assets": [
    {
      "asset_id": "/subscriptions/sub-prod-01/resourceGroups/rg-prod/providers/Microsoft.Compute/virtualMachines/vm-payment-gw",
      "display_name": "vm-payment-gw",
      "subscription_id": "sub-prod-01",
      "resource_type": "Microsoft.Compute/virtualMachines",
      "owner": "payments-platform@contoso.com",
      "criticality": "crown_jewel",
      "is_internet_exposed": true,
      "inventory_timestamp": "2026-09-29T10:00:00Z",
      "tags": {
        "tier": "pci-dss",
        "env": "prod"
      }
    },
    {
      "asset_id": "/subscriptions/sub-prod-01/resourceGroups/rg-prod/providers/Microsoft.Compute/virtualMachines/vm-analytics-worker",
      "display_name": "vm-analytics-worker",
      "subscription_id": "sub-prod-01",
      "resource_type": "Microsoft.Compute/virtualMachines",
      "owner": "data-platform@contoso.com",
      "criticality": "medium",
      "is_internet_exposed": false,
      "inventory_timestamp": "2026-09-29T10:00:00Z",
      "tags": {
        "env": "prod"
      }
    },
    {
      "asset_id": "/subscriptions/sub-prod-01/resourceGroups/rg-mgmt/providers/Microsoft.Compute/virtualMachines/vm-bastion",
      "display_name": "vm-bastion",
      "subscription_id": "sub-prod-01",
      "resource_type": "Microsoft.Compute/virtualMachines",
      "owner": "cloud-sec@contoso.com",
      "criticality": "high",
      "is_internet_exposed": true,
      "inventory_timestamp": "2026-09-29T10:00:00Z",
      "tags": {
        "env": "prod"
      }
    },
    {
      "asset_id": "/subscriptions/sub-prod-01/resourceGroups/rg-web/providers/Microsoft.Web/sites/app-service-frontend",
      "display_name": "app-service-frontend",
      "subscription_id": "sub-prod-01",
      "resource_type": "Microsoft.Web/sites",
      "owner": "frontend-team@contoso.com",
      "criticality": "high",
      "is_internet_exposed": true,
      "inventory_timestamp": "2026-09-29T10:00:00Z",
      "tags": {
        "env": "prod"
      }
    },
    {
      "asset_id": "/subscriptions/sub-dev-02/resourceGroups/rg-dev/providers/Microsoft.Web/sites/app-service-frontend",
      "display_name": "app-service-frontend",
      "subscription_id": "sub-dev-02",
      "resource_type": "Microsoft.Web/sites",
      "owner": "frontend-team@contoso.com",
      "criticality": "low",
      "is_internet_exposed": false,
      "inventory_timestamp": "2026-09-29T10:00:00Z",
      "tags": {
        "env": "dev"
      }
    },
    {
      "asset_id": "/subscriptions/sub-legacy-03/resourceGroups/rg-old/providers/Microsoft.Compute/virtualMachines/vm-legacy-mon",
      "display_name": "vm-legacy-mon",
      "subscription_id": "sub-legacy-03",
      "resource_type": "Microsoft.Compute/virtualMachines",
      "owner": "ops-archive@contoso.com",
      "criticality": "low",
      "is_internet_exposed": false,
      "inventory_timestamp": "2025-01-01T00:00:00Z",
      "tags": {
        "env": "legacy"
      }
    },
    {
      "asset_id": "/subscriptions/sub-prod-01/resourceGroups/rg-sec/providers/Microsoft.Compute/virtualMachines/vm-data-bridge",
      "display_name": "vm-data-bridge",
      "subscription_id": "sub-prod-01",
      "resource_type": "Microsoft.Compute/virtualMachines",
      "owner": "netops@contoso.com",
      "criticality": "high",
      "is_internet_exposed": true,
      "inventory_timestamp": "2026-09-29T10:00:00Z",
      "tags": {
        "env": "prod"
      }
    }
  ],
  "components": [
    {
      "component_id": "comp-log4j-prod-01",
      "asset_id": "/subscriptions/sub-prod-01/resourceGroups/rg-prod/providers/Microsoft.Compute/virtualMachines/vm-payment-gw",
      "component_name": "org.apache.logging.log4j:log4j-core",
      "installed_version": "2.14.1",
      "dependency_type": "direct",
      "file_path": "/opt/payments/lib/log4j-core-2.14.1.jar",
      "sha256": "e3b0c44298fc1c149afbf4c8996fb92427ae41e4649b934ca495991b7852b855"
    },
    {
      "component_id": "comp-log4j-analytics-02",
      "asset_id": "/subscriptions/sub-prod-01/resourceGroups/rg-prod/providers/Microsoft.Compute/virtualMachines/vm-analytics-worker",
      "component_name": "org.apache.logging.log4j:log4j-core",
      "installed_version": "2.17.1",
      "dependency_type": "transitive",
      "file_path": "/opt/spark/lib/log4j-core-2.17.1.jar",
      "sha256": "4b227777d4dd1fc61c6f884f48641d02b4d121d3fd328cb08b5531fcacdabf8a"
    },
    {
      "component_id": "comp-libwebp-bastion-03",
      "asset_id": "/subscriptions/sub-prod-01/resourceGroups/rg-mgmt/providers/Microsoft.Compute/virtualMachines/vm-bastion",
      "component_name": "libwebp",
      "installed_version": "unknown",
      "dependency_type": "direct",
      "file_path": "/usr/lib/x86_64-linux-gnu/libwebp.so",
      "sha256": "d41d8cd98f00b204e9800998ecf8427e"
    },
    {
      "component_id": "comp-runc-prod-04",
      "asset_id": "/subscriptions/sub-prod-01/resourceGroups/rg-web/providers/Microsoft.Web/sites/app-service-frontend",
      "component_name": "runc",
      "installed_version": "1.1.7",
      "dependency_type": "direct",
      "file_path": "/usr/bin/runc",
      "sha256": "9b71d224bd62f3785d96d46ad3ea3d73319bfbc2890caadae2dff72519673ca7"
    },
    {
      "component_id": "comp-runc-dev-05",
      "asset_id": "/subscriptions/sub-dev-02/resourceGroups/rg-dev/providers/Microsoft.Web/sites/app-service-frontend",
      "component_name": "runc",
      "installed_version": "1.1.12",
      "dependency_type": "direct",
      "file_path": "/usr/bin/runc",
      "sha256": "01ba4719c80b6fe911b091a7c05124b64eeece964e09c058ef8f9805daca546b"
    },
    {
      "component_id": "comp-log4j-legacy-06",
      "asset_id": "/subscriptions/sub-legacy-03/resourceGroups/rg-old/providers/Microsoft.Compute/virtualMachines/vm-legacy-mon",
      "component_name": "org.apache.logging.log4j:log4j-core",
      "installed_version": "2.12.1",
      "dependency_type": "direct",
      "file_path": "/legacy/mon/log4j-core-2.12.1.jar",
      "sha256": "7d793037a0760186574b0282f2f435e7"
    },
    {
      "component_id": "comp-log4j-bridge-07",
      "asset_id": "/subscriptions/sub-prod-01/resourceGroups/rg-sec/providers/Microsoft.Compute/virtualMachines/vm-data-bridge",
      "component_name": "org.apache.logging.log4j:log4j-core",
      "installed_version": "2.14.0",
      "dependency_type": "direct",
      "file_path": "/opt/bridge/log4j-core-2.14.0.jar",
      "sha256": "4b227777d4dd1fc61c6f884f48641d02"
    }
  ],
  "reachability": [
    {
      "reachability_id": "reach-payment-public-01",
      "asset_id": "/subscriptions/sub-prod-01/resourceGroups/rg-prod/providers/Microsoft.Compute/virtualMachines/vm-payment-gw",
      "route_type": "public_internet",
      "source_evidence": "azure-nsg-export:nsg-payment-prod",
      "port_or_protocol": "TCP/443",
      "is_blocked_by_control": false,
      "confidence": "confirmed",
      "notes": "Direct public IP mapped with inbound HTTPS permit rule."
    },
    {
      "reachability_id": "reach-analytics-internal-02",
      "asset_id": "/subscriptions/sub-prod-01/resourceGroups/rg-prod/providers/Microsoft.Compute/virtualMachines/vm-analytics-worker",
      "route_type": "internal_lateral",
      "source_evidence": "azure-nsg-export:nsg-analytics-prod",
      "port_or_protocol": "TCP/7077",
      "is_blocked_by_control": false,
      "confidence": "confirmed",
      "notes": "Private VNet subnet only; no public IP assigned."
    },
    {
      "reachability_id": "reach-bastion-public-03",
      "asset_id": "/subscriptions/sub-prod-01/resourceGroups/rg-mgmt/providers/Microsoft.Compute/virtualMachines/vm-bastion",
      "route_type": "public_internet",
      "source_evidence": "azure-nsg-export:nsg-bastion",
      "port_or_protocol": "TCP/443",
      "is_blocked_by_control": false,
      "confidence": "confirmed",
      "notes": "Azure Bastion public endpoint."
    },
    {
      "reachability_id": "reach-frontend-prod-04",
      "asset_id": "/subscriptions/sub-prod-01/resourceGroups/rg-web/providers/Microsoft.Web/sites/app-service-frontend",
      "route_type": "public_internet",
      "source_evidence": "azure-traffic-manager:contoso-web",
      "port_or_protocol": "TCP/443",
      "is_blocked_by_control": false,
      "confidence": "confirmed",
      "notes": "Public web app service."
    },
    {
      "reachability_id": "reach-frontend-dev-05",
      "asset_id": "/subscriptions/sub-dev-02/resourceGroups/rg-dev/providers/Microsoft.Web/sites/app-service-frontend",
      "route_type": "internal_lateral",
      "source_evidence": "azure-vnet-private-endpoint:pe-dev-frontend",
      "port_or_protocol": "TCP/80",
      "is_blocked_by_control": false,
      "confidence": "confirmed",
      "notes": "Internal dev private endpoint."
    },